{
  "schema_version": "1.1",
  "written": "2026-10-05",
  "description": "Machine-readable capability descriptor for every speech-to-speech provider and model family WaaV registers (plus the cascade, GPT-Live and WaaV Infer native duplex), with the regime, owners, verbs, lifecycle and release each one gets in the full-duplex interaction plan. Built from W6-providers-endpoints.md sections 3.2, 3.3, 3.4.3, 3.9, 3.14, 3.16 to 3.18 as aligned with INTEGRATION_DECISIONS.md sections 1 to 11 and Addenda A to C (A2 items 1, 2, 6 to 8 and 10 change this file); vendor facts from verify/ (wins) then web/. regime_resolve.py is the executable specification over this file; every 'expected' block is recomputed and checked by its self-test.",
  "path_roots": {
    "code": "/home/bud/ditto/waav/WaaV/gateway/src (code references are path:line relative to this root; every one was opened while writing this file)",
    "evidence": "/home/bud/ditto/waav/research/duplex-agent (evidence references are relative to this root; verify/ wins over web/)"
  },
  "vocabulary": {
    "support": ["native", "emulated", "absent", "retired"],
    "emulation": ["guided_verbatim", "gateway_clip", "user_turn_framing", "prompt_append", "drop_output", "turn_detection_toggle", "model_decides", "call_free_note"],
    "regimes": ["Cascade", "ProviderSpeech", "Delegating", "NativeDuplex"],
    "owner_values": ["gateway", "provider", "none"],
    "truth": ["enforced", "monitored"],
    "releases": {
      "lifecycle": "Lifecycle track, dated vendor changes",
      "0": "Release 0, measure and lay groundwork",
      "1": "Release 1, cascade interaction on /ws",
      "2": "Release 2, full duplex audio, the GA cascade and durable tasks",
      "3": "Release 3, speech-to-speech providers, open task protocols and text-output DAGs",
      "4": "Release 4, realtime voices on phone and rooms, Hindi and DTMF",
      "5": "Release 5, native duplex on WaaV Infer (conditional)"
    }
  },
  "surfaces": [
    {
      "id": "ws_conversation",
      "name": "/ws conversation session (conversation_config)",
      "kind": "cascade",
      "first_release": 1,
      "bud_mode": "both",
      "client_ui": true,
      "needs_background": false,
      "egress": "pump",
      "mid_call_language": "step_down",
      "source": "W6 3.10.2; INTEGRATION_DECISIONS.md section 1 and section 5 (conversation sessions); Addendum C7.1 (step-down possible here)"
    },
    {
      "id": "ws_agent",
      "name": "/ws Bud agent session (operator default, interaction-only alias or budapp entry)",
      "kind": "cascade",
      "first_release": 1,
      "bud_mode": "only",
      "client_ui": true,
      "needs_background": false,
      "egress": "pump",
      "mid_call_language": "step_down",
      "source": "W6 3.19; INTEGRATION_DECISIONS.md section 6 (sign-off 13); Addendum C7.1 (step-down possible here)"
    },
    {
      "id": "ws_raw",
      "name": "raw /ws session with a background target",
      "kind": "cascade",
      "first_release": 1,
      "bud_mode": "both",
      "client_ui": true,
      "needs_background": true,
      "egress": "pump",
      "source": "W6 3.10.2 and 3.10.4 (interaction_needs_background)"
    },
    {
      "id": "livekit",
      "name": "LiveKit room driven by a /ws session",
      "kind": "cascade",
      "first_release": 1,
      "first_release_if_echo_gates_fail": 2,
      "bud_mode": "both",
      "client_ui": true,
      "needs_background": false,
      "egress": "pump",
      "mid_call_language": "as_controlling_ws_session",
      "source": "W6 3.10.2; INTEGRATION_DECISIONS.md section 1 and sign-off 12"
    },
    {
      "id": "sip",
      "name": "SIP call through LiveKit",
      "kind": "cascade",
      "first_release": 1,
      "first_release_if_echo_gates_fail": 2,
      "bud_mode": "both",
      "client_ui": false,
      "needs_background": false,
      "egress": "pump",
      "mid_call_language": "as_controlling_ws_session",
      "source": "W6 3.10.2 and 3.12.2 (no screen; DTMF from Release 4); sign-off 12"
    },
    {
      "id": "v1_realtime_cascade",
      "name": "/v1/realtime?model=prompt:<agent> (the GA cascade)",
      "kind": "cascade",
      "first_release": 2,
      "bud_mode": "only",
      "client_ui": true,
      "needs_background": false,
      "egress": "pump",
      "source": "W6 3.10.2; cross-check-coverage.md table 2"
    },
    {
      "id": "ws_dag_text",
      "name": "/ws DAG session whose graph outputs text",
      "kind": "cascade",
      "first_release": 3,
      "bud_mode": "both",
      "client_ui": true,
      "needs_background": false,
      "egress": "pump",
      "source": "W6 Decision 22; INTEGRATION_DECISIONS.md section 6 (DagBackend)"
    },
    {
      "id": "ws_dag_audio",
      "name": "/ws DAG session whose graph outputs audio (AudioOutput, TtsProvider or RealtimeProvider node)",
      "kind": "refused",
      "first_release": null,
      "refusal": {"code": "interaction_dag_audio_output", "fatal": false},
      "bud_mode": "both",
      "client_ui": true,
      "needs_background": false,
      "egress": "none",
      "source": "W6 Decision 22; INTEGRATION_DECISIONS.md section 6; dag/definition.rs:522, :543, :552"
    },
    {
      "id": "dag_realtime_node",
      "name": "DAG realtime node (the serial turn-by-turn node LiveKit and SIP use today)",
      "kind": "refused",
      "first_release": null,
      "refusal": {"code": "interaction_dag_audio_output", "fatal": false},
      "provider_refusals": {"gpt_live": {"code": "provider_not_turn_based", "fatal": true}},
      "bud_mode": "both",
      "client_ui": false,
      "needs_background": false,
      "egress": "none",
      "source": "W6 Decision 7 and Decision 22; W6 3.10.4"
    },
    {
      "id": "realtime",
      "name": "/realtime, WaaV's native realtime protocol (non-Bud gateways only)",
      "kind": "provider",
      "first_release": 3,
      "bud_mode": "refused",
      "bud_refusal": {"code": "deployment_required", "fatal": true, "existing": true, "code_ref": "handlers/realtime/handler.rs:613-627"},
      "reaches": "all",
      "client_ui": true,
      "needs_background": true,
      "egress": "pump",
      "source": "W6 3.1 surface table and 3.10.2"
    },
    {
      "id": "v1_realtime_relay",
      "name": "/v1/realtime relay (OpenAI GA protocol, Bud deployments only)",
      "kind": "provider",
      "first_release": 3,
      "bud_mode": "only",
      "non_bud_refusal": {"code": "bud_mode_required", "fatal": true, "existing": true, "code_ref": "handlers/openai_realtime/session.rs:366-368"},
      "reaches": ["openai", "azure", "grok"],
      "vendor_names": {"openai": "openai", "azure": "azure_openai", "grok": "grok"},
      "unreached_refusal": {"code": "unsupported_vendor", "fatal": true},
      "client_ui": true,
      "needs_background": true,
      "egress": "stop_only",
      "source": "handlers/openai_realtime/upstream.rs:18; W6 3.1"
    },
    {
      "id": "v1_realtime_facade",
      "name": "/v1/realtime translate facade (Bud deployments only)",
      "kind": "provider",
      "first_release": 3,
      "bud_mode": "only",
      "non_bud_refusal": {"code": "bud_mode_required", "fatal": true, "existing": true, "code_ref": "handlers/openai_realtime/session.rs:366-368"},
      "reaches": ["gemini", "nova_sonic", "deepgram", "elevenlabs", "hume"],
      "vendor_names": {"gemini": "gemini", "nova_sonic": "nova_sonic", "deepgram": "deepgram_voice_agent", "elevenlabs": "elevenlabs_convai", "hume": "hume_evi"},
      "unreached_refusal": {"code": "unsupported_vendor", "fatal": true},
      "client_ui": true,
      "needs_background": true,
      "egress": "stop_only",
      "source": "handlers/openai_realtime/facade.rs:90-121; W6 3.1"
    },
    {
      "id": "ws_realtime_voice",
      "name": "/ws session whose voice is a realtime provider (interaction.speech.realtime), including LiveKit rooms and SIP calls",
      "kind": "provider",
      "first_release": 4,
      "bud_mode": "both",
      "reaches": "all",
      "client_ui": true,
      "needs_background": true,
      "egress": "pump",
      "source": "W6 Decision 13 and section 8 (Release 4)"
    }
  ],
  "providers": [
    {
      "id": "cascade",
      "provider_id": "cascade",
      "display_name": "Cascade: any speech-to-text, the local front model, any LLM or agent background, any text-to-speech",
      "kind": "cascade",
      "model_family": "any",
      "model_patterns": [".*"],
      "default_model": null,
      "registered_today": true,
      "available_from_release": 0,
      "ownership": {
        "turn_owner": "gateway",
        "voice_owner": "gateway",
        "voice_reproducible": {"value": "n/a", "note": "WaaV's own text-to-speech is the voice"},
        "text_output_possible": true,
        "half_cascade_possible": false,
        "reply_suppressible": true
      },
      "verbs": {
        "user_text": {"support": "absent", "wire": "n/a (typed text enters as a caller turn through the runtime)", "probe_first": false},
        "say_exact": {"support": "native", "wire": "WaaV text-to-speech of the given words", "probe_first": false},
        "say_guided": {"support": "native", "wire": "front-model line (compose grammar and guard) or W4 template", "probe_first": false},
        "add_context": {"support": "native", "wire": "front prompt observation line or background context", "probe_first": false},
        "request_reply": {"support": "native", "wire": "runtime turn", "probe_first": false},
        "stop_output": {"support": "native", "wire": "PlayoutControl::stop by utterance id", "probe_first": false},
        "hold_floor": {"support": "native", "wire": "floor machine", "probe_first": false}
      },